{
  "$schema": "../../schemas/run_module_case.schema.json",
  "name": "e2e_matmul_gfx1250_wmma_i8_tb",
  "kind": "run_module",
  "sources": [
    "matmul.mlir",
    "calls.mlir"
  ],
  "vmfb_names": [
    "matmul.vmfb",
    "calls.vmfb"
  ],
  "function": "matmul_accumulate_512x128xi8_times_512x128xi8_into_512x512xi32_for_VectorDistribute_512_128_512_acc_0",
  "inputs": [],
  "outputs": [],
  "expected_output": [],
  "checks": [],
  "run_flags": [],
  "compile_only": true,
  "skip_reason": "Generated matmul calls depend on IREE's e2e matmul test support; normalize to a run-module wrapper before enabling execution."
}
