{
  "$schema": "../../schemas/run_module_case.schema.json",
  "name": "scatter_2d_unit_batch",
  "kind": "run_module",
  "sources": [
    "module.mlir"
  ],
  "vmfb_names": [
    "module.vmfb"
  ],
  "function": "scatter_2d_unit_batch",
  "inputs": [],
  "outputs": [
    "output_0.npy"
  ],
  "expected_output": [
    {
      "kind": "file",
      "path": "scatter_2d_unit_batch_expected_output_0.npy"
    }
  ],
  "checks": [
    {
      "kind": "allclose",
      "output": 0
    }
  ],
  "run_flags": []
}
