{
  "$schema": "../../schemas/run_module_case.schema.json",
  "name": "dynamic_unpack_transpose_inner_and_outer_dims_large",
  "kind": "run_module",
  "sources": [
    "module.mlir"
  ],
  "vmfb_names": [
    "module.vmfb"
  ],
  "function": "dynamic_unpack_transpose_inner_and_outer_dims_large",
  "inputs": [],
  "outputs": [
    "output_0.npy"
  ],
  "expected_output": [
    {
      "kind": "file",
      "path": "dynamic_unpack_transpose_inner_and_outer_dims_large_expected_output_0.npy"
    }
  ],
  "checks": [
    {
      "kind": "allclose",
      "output": 0
    }
  ],
  "run_flags": []
}
