{
  "$schema": "../../schemas/run_module_case.schema.json",
  "name": "scatter_2d_multiple",
  "kind": "run_module",
  "sources": [
    "module.mlir"
  ],
  "vmfb_names": [
    "module.vmfb"
  ],
  "function": "scatter_2d_multiple",
  "inputs": [],
  "outputs": [],
  "expected_output": [],
  "checks": [],
  "run_flags": []
}
