{
  "$schema": "../../schemas/run_module_case.schema.json",
  "name": "conv2d_nopadding",
  "kind": "run_module",
  "sources": [
    "module.mlir"
  ],
  "vmfb_names": [
    "module.vmfb"
  ],
  "function": "conv2d_nopadding",
  "inputs": [],
  "outputs": [
    "output_0.npy"
  ],
  "expected_output": [
    {
      "kind": "file",
      "path": "conv2d_nopadding_expected_output_0.npy"
    }
  ],
  "checks": [
    {
      "kind": "allclose",
      "output": 0,
      "rtol": 0.001,
      "atol": 0.001
    }
  ],
  "run_flags": []
}
